{
  "$schema": "https://json-schema.org/draft/2020-12/schema",
  "$id": "https://webblock.invalid/contracts/events/provisioning/publish_completed.v1.schema.json",
  "title": "Provisioning: publish completed v1",
  "description": "OWNED BY provisioning. A release of the project went live. Payment counts it as one publish. event_key is publish-completed-<release_id>, the same for every repeat of this event.",
  "type": "object",
  "additionalProperties": false,
  "required": ["schema_version", "message_id", "message_type", "occurred_at", "correlation_id", "project_id", "event_key", "release_id"],
  "properties": {
    "schema_version": { "const": 1 },
    "message_id": { "type": "string", "format": "uuid", "minLength": 36, "maxLength": 36, "pattern": "^[0-9a-f]{8}-[0-9a-f]{4}-[0-9a-f]{4}-[0-9a-f]{4}-[0-9a-f]{12}$", "not": {"enum": ["00000000-0000-0000-0000-000000000000"]} },
    "message_type": { "const": "provisioning.publish_completed.v1" },
    "occurred_at": { "type": "string", "format": "date-time", "maxLength": 40 },
    "correlation_id": { "type": "string", "minLength": 1, "maxLength": 128, "pattern": "^[A-Za-z0-9._:-]{1,128}$" },
    "project_id": { "type": "string", "format": "uuid", "minLength": 36, "maxLength": 36, "pattern": "^[0-9a-f]{8}-[0-9a-f]{4}-[0-9a-f]{4}-[0-9a-f]{4}-[0-9a-f]{12}$", "not": {"enum": ["00000000-0000-0000-0000-000000000000"]} },
    "event_key": { "type": "string", "minLength": 54, "maxLength": 54, "pattern": "^publish-completed-[0-9a-f]{8}-[0-9a-f]{4}-[0-9a-f]{4}-[0-9a-f]{4}-[0-9a-f]{12}$" },
    "release_id": { "type": "string", "format": "uuid", "minLength": 36, "maxLength": 36, "pattern": "^[0-9a-f]{8}-[0-9a-f]{4}-[0-9a-f]{4}-[0-9a-f]{4}-[0-9a-f]{12}$", "not": {"enum": ["00000000-0000-0000-0000-000000000000"]} }
  }
}
